{
  "$schema": "https://json-schema.org/draft/2020-12/schema",
  "$id": "https://research-environment-local/schemas/project_initializer_manifest.schema.json",
  "type": "object",
  "additionalProperties": false,
  "required": [
    "$schema",
    "schema_version",
    "generated_at",
    "directories",
    "files",
    "project_agents"
  ],
  "properties": {
    "$schema": {
      "type": "string",
      "minLength": 1
    },
    "schema_version": {
      "const": "project_initializer_manifest.v1"
    },
    "generated_at": {
      "type": "string",
      "minLength": 1
    },
    "directories": {
      "type": "array",
      "items": {
        "type": "string",
        "minLength": 1
      },
      "uniqueItems": true
    },
    "files": {
      "type": "array",
      "items": {
        "$ref": "#/$defs/file_entry"
      }
    },
    "project_agents": {
      "type": "object",
      "additionalProperties": {
        "type": "object"
      }
    }
  },
  "$defs": {
    "file_entry": {
      "type": "object",
      "additionalProperties": false,
      "required": [
        "path",
        "kind",
        "content"
      ],
      "properties": {
        "path": {
          "type": "string",
          "minLength": 1
        },
        "kind": {
          "type": "string",
          "enum": [
            "text",
            "json"
          ]
        },
        "content": {}
      }
    }
  }
}
